{
  "$schema": "./theme.schema.json",
  "format": 1,
  "id": "graphite",
  "name": "Graphite",
  "order": 1,
  "credit": "No color: for focus",
  "light": {
    "base": "#fbfbfb",
    "mantle": "#f2f2f2",
    "surface0": "#e9e9e9",
    "surface1": "#dadada",
    "text": "#1d1d1f",
    "subtext": "#5c5c60",
    "accent": "#3a3a3c",
    "onAccent": "#ffffff",
    "red": "#b3261e",
    "yellow": "#8a6a10"
  },
  "dark": {
    "base": "#161617",
    "mantle": "#111112",
    "surface0": "#252527",
    "surface1": "#333336",
    "text": "#ececee",
    "subtext": "#a1a1a6",
    "accent": "#d6d6da",
    "onAccent": "#161617",
    "red": "#f28b82",
    "yellow": "#e6c26b"
  }
}
